{
  "$schema": "io-shape-v1",
  "shape_id": "heat-exchanger-plate",
  "version": "1.0",
  "display_name": "Plate Heat Exchanger",
  "category": "heat-transfer",
  "subcategory": "heat-exchanger",
  "tags": [
    "heat exchanger",
    "plate",
    "HX",
    "PHE"
  ],
  "recognition_class": "heat_exchanger_plate",
  "variants": {
    "options": {
      "default": {
        "file": "heat-exchanger-plate.svg",
        "label": "Standard"
      }
    },
    "configurations": []
  },
  "alarmBinding": {
    "stateSource": "point_alarm_state",
    "priorityMapping": {
      "1": "al-urgent",
      "2": "al-high",
      "3": "al-low",
      "4": "al-diagnostic"
    },
    "unacknowledgedFlash": true,
    "flashRate": "1Hz"
  },
  "geometry": {
    "viewBox": "-2 -2 58 20",
    "width": 58,
    "height": 20,
    "selectionBounds": {
      "x": 1,
      "y": 1,
      "w": 56,
      "h": 18
    }
  },
  "connections": [
    {
      "id": "fluid-1-in",
      "type": "process",
      "x": 0,
      "y": 0,
      "direction": "left"
    },
    {
      "id": "fluid-1-out",
      "type": "process",
      "x": 0,
      "y": 16,
      "direction": "left"
    },
    {
      "id": "fluid-2-in",
      "type": "process",
      "x": 54,
      "y": 16,
      "direction": "right"
    },
    {
      "id": "fluid-2-out",
      "type": "process",
      "x": 54,
      "y": 0,
      "direction": "right"
    }
  ],
  "textZones": [
    {
      "id": "tagname",
      "x": 27,
      "y": -8,
      "width": 58,
      "anchor": "middle",
      "fontSize": 11
    }
  ],
  "valueAnchors": [
    {
      "nx": 0.5,
      "ny": 1.15,
      "preferredElement": "text_readout"
    }
  ],
  "alarmAnchor": {
    "nx": 1.1,
    "ny": -0.1
  },
  "states": {
    "running": "io-running",
    "stopped": "io-stopped",
    "fault": "io-fault",
    "transitioning": "io-transitioning",
    "oos": "io-oos"
  },
  "addons": [],
  "defaultSlots": {
    "AlarmIndicator": "top-right",
    "TextReadout": "bottom",
    "Sparkline": "right-top",
    "PointNameLabel": "top"
  },
  "bindableParts": [
    {
      "partId": "body",
      "label": "Equipment Body",
      "category": "process"
    }
  ]
}
