{
  "$schema": "io-shape-v1",
  "shape_id": "hx-shell-tube",
  "version": "1.0",
  "display_name": "Shell & Tube Heat Exchanger",
  "category": "heat-exchange",
  "subcategory": "shell-tube",
  "tags": ["heat-exchanger", "shell-tube", "heat-transfer"],
  "recognition_class": "hx_shell_tube",
  "variants": {
    "options": {
      "opt1": { "file": "hx-shell-tube-opt1.svg", "label": "ISA Standard" }
    },
    "configurations": []
  },
  "alarmBinding": {
    "stateSource": "point_alarm_state",
    "priorityMapping": {
      "1": "alarm_critical",
      "2": "alarm_high",
      "3": "alarm_medium",
      "4": "alarm_advisory"
    },
    "unacknowledgedFlash": true,
    "flashRate": "1Hz"
  },
  "geometry": { "viewBox": "0 0 50 50", "width": 50, "height": 50 },
  "connections": [
    {
      "id": "shell-inlet",
      "type": "process",
      "x": 5,
      "y": 25,
      "direction": "left"
    },
    {
      "id": "shell-outlet",
      "type": "process",
      "x": 45,
      "y": 25,
      "direction": "right"
    }
  ],
  "textZones": [
    {
      "id": "tagname",
      "x": 25,
      "y": -6,
      "width": 50,
      "anchor": "middle",
      "fontSize": 11
    }
  ],
  "valueAnchors": [
    { "nx": 0.5, "ny": 1.15, "preferredElement": "text_readout" }
  ],
  "alarmAnchor": { "nx": 1.1, "ny": -0.1 },
  "states": {
    "running": "io-running",
    "stopped": "io-stopped",
    "fault": "io-fault",
    "transitioning": "io-transitioning",
    "oos": "io-oos"
  }
}
