{
  "$schema": "io-shape-v1",
  "shape_id": "agitator-anchor",
  "version": "1.0",
  "display_name": "Agitator \u2014 Anchor",
  "category": "agitators",
  "subcategory": "anchor",
  "tags": [
    "agitator",
    "anchor",
    "mixing",
    "part"
  ],
  "recognition_class": "agitator_anchor",
  "isPart": true,
  "partClass": "io-part-agitator",
  "variants": {
    "options": {
      "opt1": {
        "file": "agitator-anchor.svg",
        "label": "Anchor"
      }
    },
    "configurations": []
  },
  "alarmBinding": {
    "stateSource": "point_alarm_state",
    "priorityMapping": {
      "1": "al-urgent",
      "2": "al-high",
      "3": "al-low",
      "4": "al-diagnostic"
    },
    "unacknowledgedFlash": true,
    "flashRate": "1Hz"
  },
  "geometry": {
    "viewBox": "0 0 40 80",
    "width": 40,
    "height": 80,
    "bodyBase": {
      "x": 20,
      "y": 7
    },
    "selectionBounds": {
      "x": 13,
      "y": 1,
      "w": 14,
      "h": 64
    }
  },
  "connections": [
    {
      "id": "shaft-top",
      "type": "mechanical",
      "x": 20,
      "y": 7,
      "direction": "top"
    }
  ],
  "textZones": [],
  "valueAnchors": [],
  "alarmAnchor": null,
  "states": {},
  "addons": [],
  "defaultSlots": {
    "AlarmIndicator": "top-right",
    "TextReadout": "bottom",
    "Sparkline": "right-top",
    "PointNameLabel": "top"
  },
  "bindableParts": [
    {
      "partId": "body",
      "label": "Equipment Body",
      "category": "process"
    }
  ]
}