{
  "$schema": "io-shape-v1",
  "shape_id": "valve-relief-pilot-operated",
  "version": "1.0",
  "display_name": "Valve — Relief Pilot Operated",
  "category": "valves",
  "subcategory": "relief",
  "tags": [
    "valve",
    "relief",
    "pilot-operated",
    "safety",
    "pressure"
  ],
  "recognition_class": "valve_relief_pilot_operated",
  "variants": {
    "options": {
      "opt1": {
        "file": "valve-relief-pilot-operated.svg",
        "label": "ISA Standard"
      }
    },
    "configurations": []
  },
  "alarmBinding": {
    "stateSource": "point_alarm_state",
    "priorityMapping": {
      "1": "al-urgent",
      "2": "al-high",
      "3": "al-low",
      "4": "al-diagnostic"
    },
    "unacknowledgedFlash": true,
    "flashRate": "1Hz"
  },
  "geometry": {
    "viewBox": "0 0 48 62",
    "width": 48,
    "height": 62,
    "selectionBounds": {
      "x": 7,
      "y": 0,
      "w": 36,
      "h": 57
    }
  },
  "connections": [
    {
      "id": "inlet",
      "type": "process",
      "x": 20,
      "y": 62,
      "direction": "bottom"
    },
    {
      "id": "outlet",
      "type": "process",
      "x": 42,
      "y": 38,
      "direction": "right"
    },
    {
      "id": "stem-top",
      "type": "mechanical",
      "x": 20,
      "y": 0,
      "direction": "top"
    }
  ],
  "textZones": [
    {
      "id": "tagname",
      "x": 24,
      "y": -6,
      "width": 48,
      "anchor": "middle",
      "fontSize": 11
    }
  ],
  "valueAnchors": [
    {
      "nx": 1.2,
      "ny": 0.5,
      "preferredElement": "text_readout"
    }
  ],
  "alarmAnchor": {
    "nx": 1.1,
    "ny": -0.05
  },
  "states": {
    "running": "io-running",
    "stopped": "io-stopped",
    "fault": "io-fault",
    "transitioning": "io-transitioning",
    "oos": "io-oos"
  },
  "addons": [],
  "defaultSlots": {
    "AlarmIndicator": "top-right",
    "TextReadout": "right",
    "Sparkline": "right-top",
    "PointNameLabel": "top"
  },
  "bindableParts": [
    {
      "partId": "body",
      "label": "Valve Body",
      "category": "equipment"
    }
  ]
}
