{
  "$schema": "io-shape-v1",
  "shape_id": "instrument-behind-panel",
  "version": "1.0",
  "display_name": "Instrument (Behind Panel)",
  "category": "instruments",
  "subcategory": "behind-panel",
  "tags": ["instrument", "behind-panel", "inaccessible", "circle"],
  "recognition_class": "instrument_behind_panel",
  "variants": {
    "options": {
      "opt1": { "file": "instrument-behind-panel.svg", "label": "ISA Standard" }
    },
    "configurations": []
  },
  "alarmBinding": {
    "stateSource": "point_alarm_state",
    "priorityMapping": {
      "1": "alarm_critical",
      "2": "alarm_high",
      "3": "alarm_medium",
      "4": "alarm_advisory"
    },
    "unacknowledgedFlash": true,
    "flashRate": "1Hz"
  },
  "geometry": { "viewBox": "0 0 40 40", "width": 40, "height": 40 },
  "connections": [
    { "id": "signal", "type": "signal", "x": 20, "y": 4, "direction": "top" }
  ],
  "textZones": [
    {
      "id": "tag",
      "x": 20,
      "y": 20,
      "width": 30,
      "anchor": "middle",
      "fontSize": 10
    },
    {
      "id": "tagname",
      "x": 20,
      "y": -6,
      "width": 40,
      "anchor": "middle",
      "fontSize": 11
    }
  ],
  "valueAnchors": [
    { "nx": 0.5, "ny": 1.25, "preferredElement": "text_readout" }
  ],
  "alarmAnchor": { "nx": 1.15, "ny": -0.1 },
  "states": {
    "running": "io-running",
    "stopped": "io-stopped",
    "fault": "io-fault",
    "transitioning": "io-transitioning",
    "oos": "io-oos"
  }
}
