{
  "$schema": "io-shape-v1",
  "shape_id": "support-legs-3",
  "version": "1.0",
  "display_name": "Support \u2014 3 Splayed Legs",
  "category": "supports",
  "subcategory": "legs",
  "tags": [
    "support",
    "legs",
    "3-leg",
    "vessel",
    "part"
  ],
  "recognition_class": "support_legs_3",
  "isPart": true,
  "partClass": "io-part-support",
  "variants": {
    "options": {
      "opt1": {
        "file": "support-legs-3.svg",
        "label": "3 Legs"
      }
    },
    "configurations": []
  },
  "alarmBinding": {
    "stateSource": "point_alarm_state",
    "priorityMapping": {
      "1": "al-urgent",
      "2": "al-high",
      "3": "al-low",
      "4": "al-diagnostic"
    },
    "unacknowledgedFlash": true,
    "flashRate": "1Hz"
  },
  "geometry": {
    "viewBox": "0 0 40 86",
    "width": 40,
    "height": 86,
    "bodyBase": {
      "x": 20,
      "y": 68
    },
    "selectionBounds": {
      "x": 3,
      "y": 67,
      "w": 34,
      "h": 16
    }
  },
  "connections": [],
  "textZones": [],
  "valueAnchors": [],
  "alarmAnchor": null,
  "states": {},
  "addons": [],
  "defaultSlots": {
    "AlarmIndicator": "top-right",
    "TextReadout": "bottom",
    "Sparkline": "right-top",
    "PointNameLabel": "top"
  },
  "bindableParts": [
    {
      "partId": "body",
      "label": "Equipment Body",
      "category": "process"
    }
  ]
}