{
  "$schema": "io-shape-v1",
  "shape_id": "fan-blower",
  "version": "1.0",
  "display_name": "Fan / Blower",
  "category": "rotating",
  "subcategory": "fan-blower",
  "tags": [
    "fan",
    "blower",
    "rotating",
    "air"
  ],
  "recognition_class": "fan_blower",
  "variants": {
    "options": {
      "opt1": {
        "file": "fan-blower-opt1.svg",
        "label": "ISA Standard"
      },
      "opt2": {
        "file": "fan-blower-opt2.svg",
        "label": "Graphical"
      }
    },
    "configurations": []
  },
  "alarmBinding": {
    "stateSource": "point_alarm_state",
    "priorityMapping": {
      "1": "al-urgent",
      "2": "al-high",
      "3": "al-low",
      "4": "al-diagnostic"
    },
    "unacknowledgedFlash": true,
    "flashRate": "1Hz"
  },
  "geometry": {
    "viewBox": "0 0 50 50",
    "width": 50,
    "height": 50,
    "selectionBounds": {
      "x": 4,
      "y": 4,
      "w": 42,
      "h": 42
    }
  },
  "connections": [
    {
      "id": "inlet",
      "type": "process",
      "x": 5,
      "y": 25,
      "direction": "left"
    },
    {
      "id": "outlet",
      "type": "process",
      "x": 45,
      "y": 25,
      "direction": "right"
    }
  ],
  "textZones": [
    {
      "id": "tagname",
      "x": 25,
      "y": -6,
      "width": 50,
      "anchor": "middle",
      "fontSize": 11
    }
  ],
  "valueAnchors": [
    {
      "nx": 0.5,
      "ny": 1.2,
      "preferredElement": "text_readout"
    }
  ],
  "alarmAnchor": {
    "nx": 1.1,
    "ny": -0.1
  },
  "states": {
    "running": "io-running",
    "stopped": "io-stopped",
    "fault": "io-fault",
    "transitioning": "io-transitioning",
    "oos": "io-oos"
  },
  "addons": [],
  "defaultSlots": {
    "AlarmIndicator": "top-right",
    "TextReadout": "bottom",
    "Sparkline": "right-top",
    "PointNameLabel": "top"
  },
  "bindableParts": [
    {
      "partId": "body",
      "label": "Equipment Body",
      "category": "process"
    }
  ]
}
