{
  "$schema": "io-shape-v1",
  "shape_id": "interlock-sis",
  "version": "1.0",
  "display_name": "Interlock (SIS / SIF)",
  "category": "instrumentation",
  "subcategory": "interlock",
  "tags": [
    "interlock",
    "SIS",
    "SIF",
    "diamond-in-square"
  ],
  "recognition_class": "interlock_sis",
  "variants": {
    "options": {
      "default": {
        "file": "interlock-sis.svg",
        "label": "Standard"
      }
    },
    "configurations": []
  },
  "alarmBinding": {
    "stateSource": "point_alarm_state",
    "priorityMapping": {
      "1": "al-urgent",
      "2": "al-high",
      "3": "al-low",
      "4": "al-diagnostic"
    },
    "unacknowledgedFlash": true,
    "flashRate": "1Hz"
  },
  "geometry": {
    "viewBox": "0 0 60 44",
    "width": 60,
    "height": 44,
    "selectionBounds": {
      "x": 3,
      "y": 1,
      "w": 54,
      "h": 42
    }
  },
  "connections": [
    {
      "id": "nozzle-top",
      "type": "signal",
      "x": 30,
      "y": 0,
      "direction": "top"
    },
    {
      "id": "nozzle-bottom",
      "type": "signal",
      "x": 30,
      "y": 44,
      "direction": "bottom"
    },
    {
      "id": "nozzle-left",
      "type": "signal",
      "x": 2,
      "y": 22,
      "direction": "left"
    },
    {
      "id": "nozzle-right",
      "type": "signal",
      "x": 58,
      "y": 22,
      "direction": "right"
    }
  ],
  "textZones": [
    {
      "id": "tagname",
      "x": 30,
      "y": -6,
      "width": 60,
      "anchor": "middle",
      "fontSize": 11
    }
  ],
  "valueAnchors": [
    {
      "nx": 0.5,
      "ny": 1.15,
      "preferredElement": "text_readout"
    }
  ],
  "alarmAnchor": {
    "nx": 1.1,
    "ny": -0.1
  },
  "states": {
    "running": "io-running",
    "stopped": "io-stopped",
    "fault": "io-fault",
    "transitioning": "io-transitioning",
    "oos": "io-oos"
  },
  "addons": [],
  "defaultSlots": {
    "AlarmIndicator": "top-right",
    "TextReadout": "right",
    "Sparkline": "right-top",
    "PointNameLabel": "top"
  },
  "bindableParts": [
    {
      "partId": "body",
      "label": "Equipment Body",
      "category": "process"
    }
  ]
}
