{
  "$schema": "io-shape-v1",
  "shape_id": "pump-centrifugal",
  "version": "1.0",
  "display_name": "Centrifugal Pump",
  "category": "pumps",
  "subcategory": "centrifugal",
  "tags": ["pump", "centrifugal", "rotating"],
  "recognition_class": "pump_centrifugal",
  "variants": {
    "options": {
      "opt1": { "file": "pump-centrifugal-opt1.svg", "label": "ISA Standard" },
      "opt2": { "file": "pump-centrifugal-opt2.svg", "label": "Graphical" }
    },
    "configurations": []
  },
  "alarmBinding": {
    "stateSource": "point_alarm_state",
    "priorityMapping": { "1": "alarm_critical", "2": "alarm_high", "3": "alarm_medium", "4": "alarm_advisory" },
    "unacknowledgedFlash": true,
    "flashRate": "1Hz"
  },
  "geometry": { "viewBox": "0 0 48 48", "width": 48, "height": 48 },
  "connections": [
    { "id": "suction",   "type": "process", "x": 4,  "y": 24, "direction": "left" },
    { "id": "discharge", "type": "process", "x": 44, "y": 24, "direction": "right" }
  ],
  "textZones": [
    { "id": "tagname", "x": 24, "y": -6, "width": 48, "anchor": "middle", "fontSize": 11 }
  ],
  "valueAnchors": [
    { "nx": 0.5, "ny": 1.15, "preferredElement": "text_readout" }
  ],
  "alarmAnchor": { "nx": 1.1, "ny": -0.1 },
  "states": {
    "running": "io-running",
    "stopped": "io-stopped",
    "fault": "io-fault",
    "transitioning": "io-transitioning",
    "oos": "io-oos"
  }
}
