{
  "$schema": "io-shape-v1",
  "shape_id": "pump-centrifugal-opt2",
  "version": "1.0",
  "display_name": "Centrifugal Pump (Graphical)",
  "category": "pumps",
  "subcategory": "centrifugal",
  "tags": [
    "pump",
    "centrifugal",
    "rotating"
  ],
  "recognition_class": "pump_centrifugal",
  "variants": {
    "options": {
      "default": {
        "file": "pump-centrifugal-opt2.svg",
        "label": "Standard"
      }
    },
    "configurations": []
  },
  "alarmBinding": {
    "stateSource": "point_alarm_state",
    "priorityMapping": {
      "1": "al-urgent",
      "2": "al-high",
      "3": "al-low",
      "4": "al-diagnostic"
    },
    "unacknowledgedFlash": true,
    "flashRate": "1Hz"
  },
  "geometry": {
    "viewBox": "0 0 50 48",
    "width": 50,
    "height": 48,
    "selectionBounds": {
      "x": 3,
      "y": 0,
      "w": 46,
      "h": 44
    }
  },
  "connections": [
    {
      "id": "suction",
      "type": "process",
      "x": 0,
      "y": 21,
      "direction": "left"
    },
    {
      "id": "discharge",
      "type": "process",
      "x": 50,
      "y": 5,
      "direction": "right"
    }
  ],
  "textZones": [
    {
      "id": "tagname",
      "x": 25,
      "y": -6,
      "width": 50,
      "anchor": "middle",
      "fontSize": 11
    }
  ],
  "valueAnchors": [
    {
      "nx": 0.5,
      "ny": 1.15,
      "preferredElement": "text_readout"
    }
  ],
  "alarmAnchor": {
    "nx": 1.1,
    "ny": -0.1
  },
  "states": {
    "running": "io-running",
    "stopped": "io-stopped",
    "fault": "io-fault",
    "transitioning": "io-transitioning",
    "oos": "io-oos"
  },
  "addons": [],
  "defaultSlots": {
    "AlarmIndicator": "top-right",
    "TextReadout": "bottom",
    "Sparkline": "right-top",
    "PointNameLabel": "top"
  },
  "bindableParts": [
    {
      "partId": "body",
      "label": "Equipment Body",
      "category": "process"
    }
  ]
}
