{
  "$schema": "io-shape-v1",
  "shape_id": "mixer-agitator-motor",
  "version": "1.0",
  "display_name": "Agitator Mixer (with Motor)",
  "category": "mixers",
  "subcategory": "agitator",
  "tags": [
    "mixer",
    "agitator",
    "motor",
    "mixing"
  ],
  "recognition_class": "mixer_agitator_motor",
  "variants": {
    "options": {
      "default": {
        "file": "mixer-agitator-motor.svg",
        "label": "Standard"
      }
    },
    "configurations": []
  },
  "alarmBinding": {
    "stateSource": "point_alarm_state",
    "priorityMapping": {
      "1": "al-urgent",
      "2": "al-high",
      "3": "al-low",
      "4": "al-diagnostic"
    },
    "unacknowledgedFlash": true,
    "flashRate": "1Hz"
  },
  "geometry": {
    "viewBox": "0 0 60 34",
    "width": 60,
    "height": 34,
    "selectionBounds": {
      "x": 7,
      "y": 1,
      "w": 46,
      "h": 22
    }
  },
  "connections": [
    {
      "id": "nozzle-shaft",
      "type": "mechanical",
      "x": 30,
      "y": 0,
      "direction": "top"
    }
  ],
  "textZones": [
    {
      "id": "tagname",
      "x": 30,
      "y": -6,
      "width": 60,
      "anchor": "middle",
      "fontSize": 11
    }
  ],
  "valueAnchors": [
    {
      "nx": 0.5,
      "ny": 1.15,
      "preferredElement": "text_readout"
    }
  ],
  "alarmAnchor": {
    "nx": 1.1,
    "ny": -0.1
  },
  "states": {
    "running": "io-running",
    "stopped": "io-stopped",
    "fault": "io-fault",
    "transitioning": "io-transitioning",
    "oos": "io-oos"
  },
  "addons": [],
  "defaultSlots": {
    "AlarmIndicator": "top-right",
    "TextReadout": "bottom",
    "Sparkline": "right-top",
    "PointNameLabel": "top"
  },
  "bindableParts": [
    {
      "partId": "body",
      "label": "Equipment Body",
      "category": "process"
    }
  ]
}
