{
  "$schema": "io-shape-v1",
  "shape_id": "column-distillation-wide",
  "version": "1.0",
  "display_name": "Column — Wide Plain",
  "category": "columns",
  "subcategory": "distillation",
  "tags": ["column", "distillation", "separation", "fractionator", "wide"],
  "recognition_class": "column_distillation_wide",
  "variants": {
    "options": {},
    "configurations": [
      { "file": "column-distillation.svg", "label": "Standard Plain" },
      { "file": "column-distillation-trayed.svg", "label": "Trayed-6" },
      { "file": "column-distillation-trayed-10.svg", "label": "Trayed-10" },
      { "file": "column-distillation-packed.svg", "label": "Packed" },
      { "file": "column-distillation-narrow.svg", "label": "Narrow Plain" },
      { "file": "column-distillation-wide.svg", "label": "Wide Plain" }
    ]
  },
  "alarmBinding": {
    "stateSource": "point_alarm_state",
    "priorityMapping": { "1": "alarm_critical", "2": "alarm_high", "3": "alarm_medium", "4": "alarm_advisory" },
    "unacknowledgedFlash": true,
    "flashRate": "1Hz"
  },
  "geometry": { "viewBox": "0 0 50 120", "width": 50, "height": 120 },
  "connections": [
    { "id": "feed",           "type": "process", "x": 10, "y": 60,  "direction": "left" },
    { "id": "overhead-vapor", "type": "process", "x": 25, "y": 10,  "direction": "top" },
    { "id": "bottoms",        "type": "process", "x": 25, "y": 110, "direction": "bottom" }
  ],
  "textZones": [
    { "id": "tagname", "x": 25, "y": -8, "width": 50, "anchor": "middle", "fontSize": 11 }
  ],
  "valueAnchors": [
    { "nx": 1.2, "ny": 0.5, "preferredElement": "text_readout" }
  ],
  "alarmAnchor": { "nx": 1.1, "ny": -0.05 },
  "states": {
    "running": "io-running",
    "stopped": "io-stopped",
    "fault": "io-fault",
    "transitioning": "io-transitioning",
    "oos": "io-oos"
  }
}
